{
  "checks": [
    {
      "critical": true,
      "expected": "trend_reference_filter--canonical",
      "id": "task_identity",
      "kind": "exact",
      "path": "task_id",
      "weight": 5
    },
    {
      "critical": true,
      "expected": "reference_filter_reduces_noise_slows_startup",
      "id": "conclusion",
      "kind": "exact",
      "path": "conclusion",
      "weight": 30
    },
    {
      "expected": "noise_and_transient",
      "id": "analysis_regime",
      "kind": "exact",
      "path": "analysis_regime",
      "weight": 10
    },
    {
      "expected": [
        "reference_noise",
        "loop",
        "load"
      ],
      "id": "held_fixed",
      "kind": "set_contains",
      "path": "held_fixed",
      "weight": 10
    },
    {
      "expected": [
        "noise_decreases",
        "startup_time_increases"
      ],
      "id": "evidence_facts",
      "kind": "set_contains",
      "path": "evidence_facts",
      "weight": 15
    },
    {
      "expected": [
        "filter_bandwidth_rejects_noise_and_delays_reference"
      ],
      "id": "mechanism_tags",
      "kind": "set_contains",
      "path": "mechanism_tags",
      "weight": 15
    },
    {
      "expected": [
        "choose_tau_from_noise_and_startup_limits"
      ],
      "id": "recommended_actions",
      "kind": "set_contains",
      "path": "recommended_actions",
      "weight": 10
    },
    {
      "critical": true,
      "expected": [
        "maximize_tau_without_restart_test"
      ],
      "id": "forbidden_actions",
      "kind": "set_excludes",
      "path": "recommended_actions",
      "weight": 5
    }
  ],
  "critical_failure_cap": 49,
  "family_id": "trend_reference_filter",
  "pass_threshold": 70,
  "schema_version": "1.0",
  "task_id": "trend_reference_filter--canonical"
}
