{
  "checks": [
    {
      "critical": true,
      "expected": "system_output_impedance--metamorphic",
      "id": "task_identity",
      "kind": "exact",
      "path": "task_id",
      "weight": 5
    },
    {
      "critical": true,
      "expected": "estimated_droop_is_4mv",
      "id": "conclusion",
      "kind": "exact",
      "path": "conclusion",
      "weight": 30
    },
    {
      "expected": "dc",
      "id": "analysis_regime",
      "kind": "exact",
      "path": "analysis_regime",
      "weight": 10
    },
    {
      "expected": [
        "operating_point",
        "frequency_regime",
        "linearity"
      ],
      "id": "held_fixed",
      "kind": "set_contains",
      "path": "held_fixed",
      "weight": 10
    },
    {
      "expected": [
        "zout_is_80mohm",
        "step_is_50ma"
      ],
      "id": "evidence_facts",
      "kind": "set_contains",
      "path": "evidence_facts",
      "weight": 15
    },
    {
      "expected": [
        "delta_v_equals_zout_times_delta_i"
      ],
      "id": "mechanism_tags",
      "kind": "set_contains",
      "path": "mechanism_tags",
      "weight": 15
    },
    {
      "expected": [
        "report_4mv_estimate_and_verify_transient"
      ],
      "id": "recommended_actions",
      "kind": "set_contains",
      "path": "recommended_actions",
      "weight": 10
    },
    {
      "critical": true,
      "expected": [
        "claim_peak_transient_without_bandwidth"
      ],
      "id": "forbidden_actions",
      "kind": "set_excludes",
      "path": "recommended_actions",
      "weight": 5
    }
  ],
  "critical_failure_cap": 49,
  "family_id": "system_output_impedance",
  "pass_threshold": 70,
  "schema_version": "1.0",
  "task_id": "system_output_impedance--metamorphic"
}
