{
  "checks": [
    {
      "critical": true,
      "expected": "diagnosis_enable_vs_startup--counterexample",
      "id": "task_identity",
      "kind": "exact",
      "path": "task_id",
      "weight": 5
    },
    {
      "critical": true,
      "expected": "startup_state_trap",
      "id": "conclusion",
      "kind": "exact",
      "path": "conclusion",
      "weight": 30
    },
    {
      "expected": "startup_transient",
      "id": "analysis_regime",
      "kind": "exact",
      "path": "analysis_regime",
      "weight": 10
    },
    {
      "expected": [
        "dut",
        "models",
        "load",
        "supply_ramp"
      ],
      "id": "held_fixed",
      "kind": "set_contains",
      "path": "held_fixed",
      "weight": 10
    },
    {
      "expected": [
        "enable_is_active",
        "seeded_state_regulates",
        "cold_start_sticks"
      ],
      "id": "evidence_facts",
      "kind": "set_contains",
      "path": "evidence_facts",
      "weight": 15
    },
    {
      "expected": [
        "physical_escape_path_is_missing"
      ],
      "id": "mechanism_tags",
      "kind": "set_contains",
      "path": "mechanism_tags",
      "weight": 15
    },
    {
      "expected": [
        "add_self_disabling_startup_path",
        "test_restart"
      ],
      "id": "recommended_actions",
      "kind": "set_contains",
      "path": "recommended_actions",
      "weight": 10
    },
    {
      "critical": true,
      "expected": [
        "change_enable_stimulus"
      ],
      "id": "forbidden_actions",
      "kind": "set_excludes",
      "path": "recommended_actions",
      "weight": 5
    }
  ],
  "critical_failure_cap": 49,
  "family_id": "diagnosis_enable_vs_startup",
  "pass_threshold": 70,
  "schema_version": "1.0",
  "task_id": "diagnosis_enable_vs_startup--counterexample"
}
