{
  "checks": [
    {
      "critical": true,
      "expected": "trend_compensation_cap--counterexample",
      "id": "task_identity",
      "kind": "exact",
      "path": "task_id",
      "weight": 5
    },
    {
      "critical": true,
      "expected": "trend_not_identifiable",
      "id": "conclusion",
      "kind": "exact",
      "path": "conclusion",
      "weight": 30
    },
    {
      "expected": "small_signal",
      "id": "analysis_regime",
      "kind": "exact",
      "path": "analysis_regime",
      "weight": 10
    },
    {
      "expected": [
        "bias_current",
        "pass_size",
        "output_capacitance"
      ],
      "id": "held_fixed",
      "kind": "set_contains",
      "path": "held_fixed",
      "weight": 10
    },
    {
      "expected": [
        "cc_and_load_change_together",
        "phase_margin_change_is_confounded"
      ],
      "id": "evidence_facts",
      "kind": "set_contains",
      "path": "evidence_facts",
      "weight": 15
    },
    {
      "expected": [
        "held_fixed_violation",
        "causal_attribution_not_supported"
      ],
      "id": "mechanism_tags",
      "kind": "set_contains",
      "path": "mechanism_tags",
      "weight": 15
    },
    {
      "expected": [
        "rerun_cc_sweep_at_fixed_load",
        "separate_load_and_cc_interventions"
      ],
      "id": "recommended_actions",
      "kind": "set_contains",
      "path": "recommended_actions",
      "weight": 10
    },
    {
      "critical": true,
      "expected": [
        "attribute_all_change_to_cc",
        "publish_confounded_trend"
      ],
      "id": "forbidden_actions",
      "kind": "set_excludes",
      "path": "recommended_actions",
      "weight": 5
    }
  ],
  "critical_failure_cap": 49,
  "family_id": "trend_compensation_cap",
  "pass_threshold": 70,
  "schema_version": "1.0",
  "task_id": "trend_compensation_cap--counterexample"
}
