{
  "checks": [
    {
      "critical": true,
      "expected": "migration_resistor_intent--counterexample",
      "id": "task_identity",
      "kind": "exact",
      "path": "task_id",
      "weight": 5
    },
    {
      "critical": true,
      "expected": "resistor_noise_intent_not_met",
      "id": "conclusion",
      "kind": "exact",
      "path": "conclusion",
      "weight": 30
    },
    {
      "expected": "noise",
      "id": "analysis_regime",
      "kind": "exact",
      "path": "analysis_regime",
      "weight": 10
    },
    {
      "expected": [
        "feedback_ratio",
        "current_budget",
        "temperature_range"
      ],
      "id": "held_fixed",
      "kind": "set_contains",
      "path": "held_fixed",
      "weight": 10
    },
    {
      "expected": [
        "ratio_passes",
        "noise_fails"
      ],
      "id": "evidence_facts",
      "kind": "set_contains",
      "path": "evidence_facts",
      "weight": 15
    },
    {
      "expected": [
        "matching_ratio_alone_does_not_preserve_noise"
      ],
      "id": "mechanism_tags",
      "kind": "set_contains",
      "path": "mechanism_tags",
      "weight": 15
    },
    {
      "expected": [
        "select_lower_noise_resistor_option_or_current"
      ],
      "id": "recommended_actions",
      "kind": "set_contains",
      "path": "recommended_actions",
      "weight": 10
    },
    {
      "critical": true,
      "expected": [
        "approve_on_ratio_only"
      ],
      "id": "forbidden_actions",
      "kind": "set_excludes",
      "path": "recommended_actions",
      "weight": 5
    }
  ],
  "critical_failure_cap": 49,
  "family_id": "migration_resistor_intent",
  "pass_threshold": 70,
  "schema_version": "1.0",
  "task_id": "migration_resistor_intent--counterexample"
}
