{
  "checks": [
    {
      "critical": true,
      "expected": "structure_feedback_sign--metamorphic",
      "id": "task_identity",
      "kind": "exact",
      "path": "task_id",
      "weight": 5
    },
    {
      "critical": true,
      "expected": "negative_feedback",
      "id": "conclusion",
      "kind": "exact",
      "path": "conclusion",
      "weight": 30
    },
    {
      "expected": "small_signal",
      "id": "analysis_regime",
      "kind": "exact",
      "path": "analysis_regime",
      "weight": 10
    },
    {
      "expected": [
        "pmos_polarity",
        "error_amplifier_gain_sign",
        "supply_and_load"
      ],
      "id": "held_fixed",
      "kind": "set_equals",
      "path": "held_fixed",
      "weight": 10
    },
    {
      "expected": [
        "pmos_gate_falls_when_output_is_low",
        "pass_current_increases_when_pmos_gate_falls"
      ],
      "id": "evidence_facts",
      "kind": "set_equals",
      "path": "evidence_facts",
      "weight": 15
    },
    {
      "expected": [
        "loop_restores_output",
        "pmos_gate_to_current_inverting"
      ],
      "id": "mechanism_tags",
      "kind": "set_equals",
      "path": "mechanism_tags",
      "weight": 15
    },
    {
      "expected": [
        "verify_loop_gain_with_correct_break_point"
      ],
      "id": "recommended_actions",
      "kind": "set_equals",
      "path": "recommended_actions",
      "weight": 10
    },
    {
      "critical": true,
      "expected": [
        "infer_stability_margin_without_stb",
        "treat_renaming_as_topology_change"
      ],
      "id": "forbidden_actions",
      "kind": "set_excludes",
      "path": "recommended_actions",
      "weight": 5
    }
  ],
  "critical_failure_cap": 49,
  "family_id": "structure_feedback_sign",
  "pass_threshold": 70,
  "schema_version": "1.0",
  "task_id": "structure_feedback_sign--metamorphic"
}
