{
  "checks": [
    {
      "critical": true,
      "expected": "diagnosis_enable_vs_startup--metamorphic",
      "id": "task_identity",
      "kind": "exact",
      "path": "task_id",
      "weight": 5
    },
    {
      "critical": true,
      "expected": "dut_disabled",
      "id": "conclusion",
      "kind": "exact",
      "path": "conclusion",
      "weight": 30
    },
    {
      "expected": "dc_operating_point",
      "id": "analysis_regime",
      "kind": "exact",
      "path": "analysis_regime",
      "weight": 10
    },
    {
      "expected": [
        "dut",
        "models",
        "load"
      ],
      "id": "held_fixed",
      "kind": "set_equals",
      "path": "held_fixed",
      "weight": 10
    },
    {
      "expected": [
        "enable_is_inactive",
        "simulation_completed"
      ],
      "id": "evidence_facts",
      "kind": "set_equals",
      "path": "evidence_facts",
      "weight": 15
    },
    {
      "expected": [
        "zero_output_is_expected_when_disabled"
      ],
      "id": "mechanism_tags",
      "kind": "set_equals",
      "path": "mechanism_tags",
      "weight": 15
    },
    {
      "expected": [
        "correct_enable_then_rerun_unchanged_dut"
      ],
      "id": "recommended_actions",
      "kind": "set_equals",
      "path": "recommended_actions",
      "weight": 10
    },
    {
      "critical": true,
      "expected": [
        "add_startup_branch"
      ],
      "id": "forbidden_actions",
      "kind": "set_excludes",
      "path": "recommended_actions",
      "weight": 5
    }
  ],
  "critical_failure_cap": 49,
  "family_id": "diagnosis_enable_vs_startup",
  "pass_threshold": 70,
  "schema_version": "1.0",
  "task_id": "diagnosis_enable_vs_startup--metamorphic"
}
