{
  "checks": [
    {
      "critical": true,
      "expected": "migration_corner_mapping--counterexample",
      "id": "task_identity",
      "kind": "exact",
      "path": "task_id",
      "weight": 5
    },
    {
      "critical": true,
      "expected": "corner_mapping_invalid",
      "id": "conclusion",
      "kind": "exact",
      "path": "conclusion",
      "weight": 30
    },
    {
      "expected": "execution_status",
      "id": "analysis_regime",
      "kind": "exact",
      "path": "analysis_regime",
      "weight": 10
    },
    {
      "expected": [
        "supply",
        "temperature",
        "model_release"
      ],
      "id": "held_fixed",
      "kind": "set_equals",
      "path": "held_fixed",
      "weight": 10
    },
    {
      "expected": [
        "short_label_matches_but_semantics_differ"
      ],
      "id": "evidence_facts",
      "kind": "set_equals",
      "path": "evidence_facts",
      "weight": 15
    },
    {
      "expected": [
        "reported_robustness_covers_wrong_condition"
      ],
      "id": "mechanism_tags",
      "kind": "set_equals",
      "path": "mechanism_tags",
      "weight": 15
    },
    {
      "expected": [
        "map_from_model_definitions_and_temperature"
      ],
      "id": "recommended_actions",
      "kind": "set_equals",
      "path": "recommended_actions",
      "weight": 10
    },
    {
      "critical": true,
      "expected": [
        "accept_label_match"
      ],
      "id": "forbidden_actions",
      "kind": "set_excludes",
      "path": "recommended_actions",
      "weight": 5
    }
  ],
  "critical_failure_cap": 49,
  "family_id": "migration_corner_mapping",
  "pass_threshold": 70,
  "schema_version": "1.0",
  "task_id": "migration_corner_mapping--counterexample"
}
