{
  "checks": [
    {
      "critical": true,
      "expected": "architecture_pass_device_choice--counterexample",
      "id": "task_identity",
      "kind": "exact",
      "path": "task_id",
      "weight": 5
    },
    {
      "critical": true,
      "expected": "nmos_gate_headroom_is_insufficient",
      "id": "conclusion",
      "kind": "exact",
      "path": "conclusion",
      "weight": 30
    },
    {
      "expected": "dc_operating_point",
      "id": "analysis_regime",
      "kind": "exact",
      "path": "analysis_regime",
      "weight": 10
    },
    {
      "expected": [
        "load",
        "device_options",
        "iq_budget"
      ],
      "id": "held_fixed",
      "kind": "set_equals",
      "path": "held_fixed",
      "weight": 10
    },
    {
      "expected": [
        "gate_cannot_rise_above_input_rail",
        "source_target_is_close_to_input"
      ],
      "id": "evidence_facts",
      "kind": "set_equals",
      "path": "evidence_facts",
      "weight": 15
    },
    {
      "expected": [
        "nmos_source_follower_lacks_required_overdrive"
      ],
      "id": "mechanism_tags",
      "kind": "set_equals",
      "path": "mechanism_tags",
      "weight": 15
    },
    {
      "expected": [
        "use_pmos_or_approved_boosted_driver"
      ],
      "id": "recommended_actions",
      "kind": "set_equals",
      "path": "recommended_actions",
      "weight": 10
    },
    {
      "critical": true,
      "expected": [
        "force_gate_above_supply_ideally"
      ],
      "id": "forbidden_actions",
      "kind": "set_excludes",
      "path": "recommended_actions",
      "weight": 5
    }
  ],
  "critical_failure_cap": 49,
  "family_id": "architecture_pass_device_choice",
  "pass_threshold": 70,
  "schema_version": "1.0",
  "task_id": "architecture_pass_device_choice--counterexample"
}
