{
  "checks": [
    {
      "critical": true,
      "expected": "architecture_loop_style_choice--counterexample",
      "id": "task_identity",
      "kind": "exact",
      "path": "task_id",
      "weight": 5
    },
    {
      "critical": true,
      "expected": "architecture_evidence_is_incomplete",
      "id": "conclusion",
      "kind": "exact",
      "path": "conclusion",
      "weight": 30
    },
    {
      "expected": "small_signal",
      "id": "analysis_regime",
      "kind": "exact",
      "path": "analysis_regime",
      "weight": 10
    },
    {
      "expected": [
        "load_range",
        "iq_budget",
        "output_cap"
      ],
      "id": "held_fixed",
      "kind": "set_equals",
      "path": "held_fixed",
      "weight": 10
    },
    {
      "expected": [
        "local_loop_was_not_measured",
        "interaction_is_unknown"
      ],
      "id": "evidence_facts",
      "kind": "set_equals",
      "path": "evidence_facts",
      "weight": 15
    },
    {
      "expected": [
        "one_loop_measurement_cannot_qualify_nested_loops"
      ],
      "id": "mechanism_tags",
      "kind": "set_equals",
      "path": "mechanism_tags",
      "weight": 15
    },
    {
      "expected": [
        "measure_each_return_ratio_and_closed_loop_transient"
      ],
      "id": "recommended_actions",
      "kind": "set_equals",
      "path": "recommended_actions",
      "weight": 10
    },
    {
      "critical": true,
      "expected": [
        "approve_from_global_margin_only"
      ],
      "id": "forbidden_actions",
      "kind": "set_excludes",
      "path": "recommended_actions",
      "weight": 5
    }
  ],
  "critical_failure_cap": 49,
  "family_id": "architecture_loop_style_choice",
  "pass_threshold": 70,
  "schema_version": "1.0",
  "task_id": "architecture_loop_style_choice--counterexample"
}
