{
  "checks": [
    {
      "critical": true,
      "expected": "A",
      "id": "q1",
      "kind": "exact",
      "path": "answers.q1",
      "weight": 30
    },
    {
      "critical": true,
      "expected": "C",
      "id": "q2",
      "kind": "exact",
      "path": "answers.q2",
      "weight": 30
    },
    {
      "critical": false,
      "expected": "D",
      "id": "q3",
      "kind": "exact",
      "path": "answers.q3",
      "weight": 25
    },
    {
      "critical": false,
      "expected": "A",
      "id": "q4",
      "kind": "exact",
      "path": "answers.q4",
      "weight": 15
    }
  ],
  "critical_failure_cap": 49,
  "family_id": "v06-design-closure-04-spec-interaction",
  "pass_threshold": 70,
  "schema_version": "1.0",
  "task_id": "v06-design-closure-04-spec-interaction"
}
